{
  "$id": "ddd-web-app-v2.4.0.json",
  "$schema": "./ddd-schema.json",
  "meta": {
    "id": "ddd-webapp-template",
    "version": "2.4.0",
    "title": "Web Application Documents",
    "description": "DDD documentation framework. AI reads this file and generates .md files in the correct order with proper cross-references.",
    "language": "th+en",
    "output_dir": "docs/",
    "generation_order": [
      "personas",
      "constraints",
      "vpd",
      "scope",
      "prd",
      "glossary",
      "architecture",
      "adr",
      "data_model",
      "ui_spec",
      "tracking_plan",
      "security",
      "api_spec",
      "agents_md",
      "tasks",
      "deployment",
      "testing",
      "changelog",
      "runbook",
      "readme"
    ],
    "agent_instructions": {
      "role": "You are a technical documentation generator. Read this file and produce each document listed in phases[], in dependency order.",
      "generation_order_strategy": "Topological sort by depends_on graph. Generate documents with no dependencies first.",
      "content_language": "Write document content in Thai for narrative sections; use English for all identifiers, code, field names, and technical terms.",
      "quality_gate": "Each document must cover all sections[] listed. Validate that cross-references (refs[]) resolve to real document IDs before finishing."
    }
  },
  "phases": [
    {
      "id": "phase_discovery",
      "order": 1,
      "title": {
        "th": "Discovery & Definition",
        "en": "Discovery & Definition"
      },
      "description": {
        "th": "เป้าหมาย: ทำความเข้าใจ \"What & Why\" ก่อนเริ่มสร้างอะไรทั้งสิ้น",
        "en": "Goal: Understand 'What & Why' before building anything."
      },
      "documents": [
        {
          "id": "personas",
          "filename": "PERSONAS.md",
          "title": "Personas",
          "description": {
            "th": "ระบุ target users, pain points, use cases หลัก",
            "en": "Identify target users, pain points, and primary use cases."
          },
          "priority": "P0",
          "depends_on": [],
          "output_format": {
            "type": "markdown",
            "suggested_headings": [
              "Persona Profiles",
              "Pain Points",
              "Primary Use Cases",
              "Critical Paths"
            ]
          },
          "agent_hints": {
            "instruction": "Generate a PERSONAS.md that defines each target user group with name, role, technical skill level, key pain points this system solves, primary use cases, and the actions they cannot afford to miss (critical path).",
            "input_context": "Use project description and business goals as primary input.",
            "estimated_length": "500-800 words",
            "validation": "Each persona must have: name, role, technical_skill, pain_points[], use_cases[], critical_path[]."
          },
          "sections": [
            {
              "id": "persona_profiles",
              "heading": "Persona Profiles",
              "description": {
                "th": "ชื่อ, role, ระดับ technical skill ของแต่ละ persona",
                "en": "Name, role, and technical skill level per persona."
              },
              "refs": [],
              "items": [
                {
                  "text_th": "ชื่อ persona, role, ระดับ technical skill",
                  "text_en": "Persona name, role, technical skill level"
                },
                {
                  "text_th": "Pain points ที่ระบบนี้แก้ให้",
                  "text_en": "Pain points this system solves"
                },
                {
                  "text_th": "Primary use cases ของแต่ละ persona",
                  "text_en": "Primary use cases per persona"
                }
              ]
            },
            {
              "id": "pain_points",
              "heading": "Pain Points",
              "description": {
                "th": "ความเจ็บปวดหลักของ users ที่ระบบต้องแก้",
                "en": "Primary pain points the system must address."
              },
              "refs": [],
              "items": [
                {
                  "text_th": "Pain Point — ปัญหาเฉพาะเจาะจงที่ persona นี้เผชิญอยู่",
                  "text_en": "Pain Point — specific problem this persona faces"
                },
                {
                  "text_th": "Frequency — เจอปัญหานี้บ่อยแค่ไหน",
                  "text_en": "Frequency — how often this pain is experienced"
                },
                {
                  "text_th": "Current Workaround — วิธีที่ใช้อยู่ตอนนี้ (ก่อนมีระบบ)",
                  "text_en": "Current Workaround — how this pain is handled today"
                }
              ]
            },
            {
              "id": "primary_use_cases",
              "heading": "Primary Use Cases",
              "description": {
                "th": "Use cases หลักของแต่ละ persona",
                "en": "Primary use cases per persona."
              },
              "refs": [],
              "items": [
                {
                  "text_th": "Use Case — การกระทำหลักที่ persona ต้องทำในระบบ",
                  "text_en": "Use Case — primary action the persona must perform in the system"
                },
                {
                  "text_th": "Trigger — เหตุการณ์ที่ทำให้เริ่ม use case นี้",
                  "text_en": "Trigger — event that initiates this use case"
                },
                {
                  "text_th": "Expected Outcome — ผลลัพธ์ที่ persona คาดหวัง",
                  "text_en": "Expected Outcome — what the persona expects as a result"
                }
              ]
            },
            {
              "id": "critical_paths",
              "heading": "Critical Paths",
              "description": {
                "th": "สิ่งที่ persona ห้ามพลาดในการใช้ระบบ",
                "en": "Actions this persona absolutely cannot miss."
              },
              "refs": [],
              "items": [
                {
                  "text_th": "Critical Action — สิ่งที่ 'ห้ามพลาด' หากพลาดจะกระทบธุรกิจ",
                  "text_en": "Critical Action — must-not-miss action; missing it impacts the business"
                },
                {
                  "text_th": "Failure Impact — ผลกระทบถ้าทำไม่ได้หรือทำผิด",
                  "text_en": "Failure Impact — consequences if this action fails or is missed"
                },
                {
                  "text_th": "Frequency — ทำบ่อยแค่ไหน (daily/weekly/on-demand)",
                  "text_en": "Frequency — how often this action occurs (daily/weekly/on-demand)"
                }
              ]
            }
          ]
        },
        {
          "id": "constraints",
          "filename": "CONSTRAINTS.md",
          "title": "Constraints",
          "description": {
            "th": "ข้อจำกัด เช่น PDPA compliance, security requirements, budget/timeline",
            "en": "Legal, technical, security, business, and integration constraints."
          },
          "priority": "P0",
          "depends_on": [],
          "output_format": {
            "type": "markdown",
            "suggested_headings": [
              "Legal and Compliance Constraints",
              "Technical Constraints",
              "Security Constraints",
              "Business Constraints",
              "Integration Constraints"
            ]
          },
          "agent_hints": {
            "instruction": "Generate a CONSTRAINTS.md documenting all fixed constraints the system must operate within. Cover legal/compliance (PDPA, cybersecurity laws), mandatory tech stack, security requirements, business limits (budget, deadline, SLA), and required integrations.",
            "input_context": "Gather from stakeholder interviews and project brief. These constraints are non-negotiable inputs to architecture decisions.",
            "estimated_length": "600-900 words",
            "validation": "Must address all five constraint categories. Each constraint must be stated as a clear, testable requirement."
          },
          "sections": [
            {
              "id": "legal_compliance",
              "heading": "Legal and Compliance Constraints",
              "description": {
                "th": "ข้อจำกัดด้านกฎหมาย เช่น PDPA, พรบ. Cybersecurity",
                "en": "Legal and regulatory constraints such as PDPA and cybersecurity laws."
              },
              "refs": [],
              "items": [
                {
                  "text_th": "PDPA / Data Privacy — ข้อกำหนดการเก็บและใช้ข้อมูลส่วนบุคคล",
                  "text_en": "PDPA / Data Privacy — requirements for collecting and processing personal data"
                },
                {
                  "text_th": "Cybersecurity Act — ข้อกำหนดตาม พรบ. Cybersecurity",
                  "text_en": "Cybersecurity Act — requirements per applicable cybersecurity legislation"
                },
                {
                  "text_th": "Industry Standards — เช่น ISO 27001, SOC 2 ที่ต้อง comply",
                  "text_en": "Industry Standards — e.g. ISO 27001, SOC 2 compliance requirements"
                }
              ]
            },
            {
              "id": "technical_constraints",
              "heading": "Technical Constraints",
              "description": {
                "th": "ข้อจำกัดด้าน tech stack, platform, browser support",
                "en": "Mandatory technology, platform, and compatibility constraints."
              },
              "refs": [],
              "items": [
                {
                  "text_th": "Mandatory Tech Stack — framework/library ที่บังคับใช้และห้ามเปลี่ยน",
                  "text_en": "Mandatory Tech Stack — frameworks/libraries that are fixed and cannot be changed"
                },
                {